<?xml version="1.0" encoding="UTF-8"?>
<!-- Antonio Ruvalcaba Mata -->

<veterinaria xmlns:xsi="http://www.w3.org/2001/XMLSchema-instance" xsi:noNamespaceSchemaLocation="mascotas.xsd">
    <clientes>
        <cliente>
            <id>C-101</id>
            <nombre>Carlos Ruiz</nombre>
            <telefono>555-1234</telefono>
            <mascota>
                <nombre>Toby</nombre>
                <especie>Perro</especie>
                <servicios>
                    <servicio>
                        <Servicio>Baño y corte</Servicio>
                        <fecha>2026-03-10</fecha>
                        <precio>350</precio>
                    </servicio>
                    <servicio>
                        <Servicio>Vacuna antirrabica</Servicio>
                        <fecha>2026-03-10</fecha>
                        <precio>250</precio>
                    </servicio>                    
                </servicios>
            </mascota>
        </cliente>
        <cliente>
            <id>C-102</id>
            <nombre>Laura Gomez</nombre>
            <telefono>555-5678</telefono>
            <mascota>
                <nombre>Michi</nombre>
                <especie>Gato</especie>
                <servicios>
                    <servicio>
                        <Servicio>Desparasitacion</Servicio>
                        <fecha>2026-03-11</fecha>
                        <precio>180</precio>
                    </servicio>
                    <servicio>
                        <Servicio>Limpieza dental</Servicio>
                        <fecha>2026-03-11</fecha>
                        <precio>400</precio>
                    </servicio>                    
                </servicios>
            </mascota>
        </cliente>
        <cliente>
            <id>C-103</id>
            <nombre>Roberto Diaz</nombre>
            <telefono>555-9012</telefono>
            <mascota>
                <nombre>Max</nombre>
                <especie>Perro</especie>
                <servicios>
                    <servicio>
                        <Servicio>Revision general</Servicio>
                        <fecha>2026-03-12</fecha>
                        <precio>300</precio>
                    </servicio>
                    <servicio>
                        <Servicio>Corte de uñas</Servicio>
                        <fecha>2026-03-12</fecha>
                        <precio>100</precio>
                    </servicio>                    
                </servicios>
            </mascota>
        </cliente>
    </clientes>
</veterinaria>